{
  "schemaVersion": "1.0",
  "generatedAt": "2026-10-02T04:47:59.000000Z",
  "transaction": {
    "chainId": 8453,
    "from": "0x2ba27DFC9D58eAD3BaaAE9BE108af5FD5bB65705",
    "to": "0x44914408af82bC9983bbb330e3578E1105e11d4e",
    "data": "0xfb7830cf000000000000000000000000000000000000000000000000000000000000000000000000000000000000000000000000000000000000000000000000000001800000000000000000000000000000000000000000000000000000000000000200000000000000000000000000000000000000000000000000000000000000040000000000000000000000000000000000000000000000000000000000000000010000000000000000000000000000000000000000000000000000000005f5e10000000000000000000000000000000000000000000000000000000000000000000000000000000000000000000000000000000000000000000000000000000000000000000000000000000000000000000000000000000000000000000000000100000000000000000000000000000000000000000000000000000000000000000000000000000000000000000000000000000000000000000000000000000000000000000000000000000000000000000000000000000000000000000000000000000000000000000000000000000000000000000000000000000000000000418de9b81ef1c0e556e125e3029bcfd843848925dd6723ccc3cdf9024f00699a66449b8fd4229d600c3b74f1942e331b2e76089a594a122284a1ebd021b12183931b0000000000000000000000000000000000000000000000000000000000000000000000000000000000000000000000000000000000000000000000000001e000000000000000000000000016a264040ddc08421a25de638321b217f01d050f00000000000000000000000000000000000000000000000000000000000000010000000000000000000000000000000000000000000000000000000000000000000000000000000000000000000000000000000000000000000000000000000000000000000000000000000000000000000000000000000000000000009896800000000000000000000000000000000000000000000000000003135cf1b66b9c000000000000000000000000000000000000000000000000000000000000000000000000000000000000000000000000000000000000000000000035ae079840000000000000000000000000000000000000000000000000000000000000000000000000000000000000000000000000000000000000000000000000000000000000000000000000000000000000000000000000000000000000000000000000000000000000000000000000000000000000000000000000000000000000000000000000000000000000000000000000000000000000000000000002540be400000000000000000000000000000000000000000000000000000001a0faf297ea24fa2afb774f5947a5aa974a476b88e94b66dd5cbb0ea24e5e87078bfbb887d10000000000000000000000000000000000000000000000000000000000000001000000000000000000000000000000000000000000000000000000000000002000000000000000000000000000000000000000000000000000000000000000792a22999a0e74d72d9b81b9f32ec6c556053b196c379dfb26aa2e82f7bf266122fe8d9c1476fcb85d12ffeff848e3c015efe0357db701543ce30dd6073cd978dd9bdc59aa00003293c7d37500065cd43c7b4e400301000000010400000007dfa857c87204fff80500000000741063740c0100065cd43c7b4e400000000000000062635f73637869696d61390b0080218021802180218021802180218021",
    "value": "1",
    "source": {
      "name": "Base Blockscout",
      "transactionHash": "0x9f49761cfaa78094eed041fb19ba770457ff95efcc36dc7a6657c303868e34e4",
      "explorerUrl": "https://base.blockscout.com/tx/0x9f49761cfaa78094eed041fb19ba770457ff95efcc36dc7a6657c303868e34e4",
      "blockNumber": 52063566,
      "timestamp": "2026-10-02T04:47:59.000000Z",
      "observedStatus": "success"
    }
  },
  "intent": {
    "schemaVersion": "1.0",
    "protocol": "avantis",
    "adapter": "avantis-veranta-v2",
    "chainId": 8453,
    "sender": "0x2ba27DFC9D58eAD3BaaAE9BE108af5FD5bB65705",
    "target": "0x44914408af82bC9983bbb330e3578E1105e11d4e",
    "nativeValue": "1",
    "deadline": "1790916597",
    "transactionFingerprint": "0x65553dca9974bee6d96016fa6ba8d576f43515c624dd6e5d4bfead6fcb97a510",
    "actions": [
      {
        "kind": "avantis",
        "index": 0,
        "operation": "open",
        "trader": "0x16A264040DDC08421A25dE638321b217f01D050f",
        "pairIndex": 1,
        "positionIndex": "0",
        "side": "short",
        "orderType": "market",
        "sizing": "usdc",
        "collateral": {
          "value": "10000000",
          "mode": "exact"
        },
        "leverage": "230553000000",
        "slippageP": "10000000000",
        "openPrice": "865714843315100",
        "takeProfit": "0",
        "stopLoss": "0",
        "signedIntent": true,
        "intentType": "OpenTradeReq",
        "intentMessage": {
          "_t": {
            "trader": "0x16A264040DDC08421A25dE638321b217f01D050f",
            "pairIndex": "1",
            "index": "0",
            "initialPosToken": "0",
            "positionSizeUSDC": "10000000",
            "openPrice": "865714843315100",
            "buy": false,
            "leverage": "230553000000",
            "tp": "0",
            "sl": "0",
            "timestamp": "0"
          },
          "_type": 0,
          "_slippageP": "10000000000",
          "_deadline": "1790916597738",
          "_nonce": "16725270968050169613112843759546929482676576543108162512794114288641887471569"
        },
        "signature": "0x8de9b81ef1c0e556e125e3029bcfd843848925dd6723ccc3cdf9024f00699a66449b8fd4229d600c3b74f1942e331b2e76089a594a122284a1ebd021b12183931b",
        "deadlineMs": "1790916597738",
        "nonce": "16725270968050169613112843759546929482676576543108162512794114288641887471569"
      }
    ],
    "expectedBalanceChanges": [
      {
        "account": "0x16A264040DDC08421A25dE638321b217f01D050f",
        "asset": "0x833589fCD6eDb6E08f4c7C32D4f71b54bdA02913",
        "assetSymbol": "USDC",
        "category": "asset",
        "direction": "debit",
        "amount": {
          "value": "10000000",
          "mode": "exact"
        },
        "reason": "Avantis open collateral"
      }
    ],
    "warnings": [
      "Avantis prices, leverage, slippage and coin exposure use 1e10 fixed-point units."
    ],
    "source": {
      "name": "Base Blockscout",
      "transactionHash": "0x9f49761cfaa78094eed041fb19ba770457ff95efcc36dc7a6657c303868e34e4",
      "explorerUrl": "https://base.blockscout.com/tx/0x9f49761cfaa78094eed041fb19ba770457ff95efcc36dc7a6657c303868e34e4",
      "blockNumber": 52063566,
      "timestamp": "2026-10-02T04:47:59.000000Z",
      "observedStatus": "success"
    }
  },
  "policy": {
    "outcome": "pass",
    "findings": []
  },
  "simulation": {
    "attempted": true,
    "success": true,
    "transactionFingerprint": "0x65553dca9974bee6d96016fa6ba8d576f43515c624dd6e5d4bfead6fcb97a510",
    "blockHash": "0x32cf54e7987e1530c23c93ed77727b0f0590c6a0107a28ae252c6c334b5ef460",
    "rpcUrl": "https://mainnet.base.org",
    "blockNumber": "52063565"
  },
  "finalDecision": "pass",
  "avantis": {
    "transactionFingerprint": "0x65553dca9974bee6d96016fa6ba8d576f43515c624dd6e5d4bfead6fcb97a510",
    "status": "ready",
    "blockNumber": "52063565",
    "blockHash": "0x32cf54e7987e1530c23c93ed77727b0f0590c6a0107a28ae252c6c334b5ef460",
    "blockTimestamp": 1790916477,
    "checks": [
      {
        "actionIndex": 0,
        "trader": "0x16A264040DDC08421A25dE638321b217f01D050f",
        "nonce": "16725270968050169613112843759546929482676576543108162512794114288641887471569",
        "status": "valid",
        "signer": "0xfD4420cb60871833Ef33cD775D486Ac71E7b495C",
        "digest": "0xe24122a1c00411b0f49fc4c2c02675ed6740340a2a381233d212091493255970",
        "nonceUsed": false,
        "delegated": true,
        "delegationExpiry": "1796637304"
      }
    ]
  }
}
